{
  "schema_version": 1,
  "sprint_id": "sprint-20260808T083901900797Z",
  "task_id": "figure-q2",
  "role": "figure",
  "problem": "C",
  "question": "Q2",
  "status": "PENDING",
  "attempt": 1,
  "max_attempts": 2,
  "dependencies": [],
  "input_hashes": [
    {"path": "problems/C/questions/Q2/question.yaml", "kind": "file", "exists": true, "sha256": "494f3a29fe3e99c5515977f13432dccbfeb12c787f78b16cd6eb400b79b6cb11"},
    {"path": "contest.yaml", "kind": "file", "exists": true, "sha256": "16a7271107e2bd211293a8b735e961783dc4ac48651e9d709673e1781cd27272"},
    {"path": "config/workflow.yaml", "kind": "file", "exists": true, "sha256": "baaa782a9dd8b0d493b59163d22f5a74ec3b371c8aa0f2898a613406b9aff469"},
    {"path": "results/C/claims.json", "kind": "file", "exists": true, "sha256": "cef4f43848ba16de8cf215c8dcc2b8067a4d759d069e51aaaecf6e43cccb8f79"},
    {"path": "experiments/C/Q2/q2-full-compat-20260808/q2_compat_summary.json", "kind": "file", "exists": true, "sha256": "537062db28c59783fc8c0fcc9e26f153b613954a7b3631f5f215013eeecb3670"},
    {"path": "sprints/sprint-20260808T031146908286Z/merged/solver-q2/q2_full_summary.json", "kind": "file", "exists": true, "sha256": "68f503df0646e34d9e76680b5c104c3720a5af443c662ba32427299ee02f8cb1"},
    {"path": "sprints/sprint-20260808T031146908286Z/merged/solver-q2/q2_full_hourly_profiles.csv", "kind": "file", "exists": true, "sha256": "129c23e73ed9d0ec7398f1a787d9426f0a8d54851a9153f3f96741871404dd47"},
    {"path": "sprints/sprint-20260808T031146908286Z/merged/solver-q2/q2_full_block_robustness.csv", "kind": "file", "exists": true, "sha256": "2ac7d8a6da49d09319359317931371b7f16c7f9e872a81f2d64a11e58dfdbaa4"},
    {"path": "paper/figures/generate_q1_figures.py", "kind": "file", "exists": true, "sha256": "6f090b8a3151b9b50fd2f74d6574a3a07e71f491244bfc67f42d7d19e31e48ae"}
  ],
  "allowed_read_paths": ["problems/C/questions/Q2/question.yaml", "contest.yaml", "config/workflow.yaml", "config/figure_style.yaml", "results/C/claims.json", "experiments/C/Q2", "sprints/sprint-20260808T031146908286Z/merged/solver-q2", "paper/figures/generate_q1_figures.py", "src", "workspace://src", "workspace://config"],
  "write_directory": "sprints/sprint-20260808T083901900797Z/staging/figure-q2",
  "expected_outputs": ["sprints/sprint-20260808T083901900797Z/staging/figure-q2/handoff.json", "sprints/sprint-20260808T083901900797Z/staging/figure-q2/figure_contract_proposals.yaml", "sprints/sprint-20260808T083901900797Z/staging/figure-q2/generate_q2_figures.py", "sprints/sprint-20260808T083901900797Z/staging/figure-q2/fig_q2_dispatch_comparison.pdf", "sprints/sprint-20260808T083901900797Z/staging/figure-q2/fig_q2_dispatch_comparison.svg", "sprints/sprint-20260808T083901900797Z/staging/figure-q2/fig_q2_dispatch_comparison.png"],
  "target_gate": "G5",
  "deadline_utc": "2026-08-10 20:00:00+08:00",
  "root_only_paths": ["state/decision_log.json", "results/C/claims.json", "paper/main.tex", "paper/figure_contracts.yaml", "output/"],
  "sprint_profile": "default",
  "input_sprint_id": null
}
