{
  "schema_version": 1,
  "sprint_id": "sprint-20260808T113706086579Z",
  "task_id": "figure-q1q4-system",
  "role": "figure",
  "problem": "C",
  "question": "Q1-Q4",
  "status": "PENDING",
  "attempt": 1,
  "max_attempts": 2,
  "dependencies": [],
  "input_hashes": [
    {"path": "problems/C/questions/Q1/question.yaml", "kind": "file", "exists": true, "sha256": "a6d457c3df7d5591f393ffbca5aad8e4cf3514243a6855ebfe56fae4d3ab0333"},
    {"path": "problems/C/questions/Q2/question.yaml", "kind": "file", "exists": true, "sha256": "494f3a29fe3e99c5515977f13432dccbfeb12c787f78b16cd6eb400b79b6cb11"},
    {"path": "problems/C/questions/Q3/question.yaml", "kind": "file", "exists": true, "sha256": "6bf051de9ca11fb957dba22ceb905c1107455a4d48d8140caf47fd309543b511"},
    {"path": "problems/C/questions/Q4/question.yaml", "kind": "file", "exists": true, "sha256": "5749fcfc0c2f172008d03608949b89881894bfae91069a921df35a56092b286c"},
    {"path": "contest.yaml", "kind": "file", "exists": true, "sha256": "16a7271107e2bd211293a8b735e961783dc4ac48651e9d709673e1781cd27272"},
    {"path": "config/workflow.yaml", "kind": "file", "exists": true, "sha256": "baaa782a9dd8b0d493b59163d22f5a74ec3b371c8aa0f2898a613406b9aff469"},
    {"path": "problems/C/source/problem-C.pdf", "kind": "file", "exists": true, "sha256": "0adc971ab421a7de5e3dd1c19c8540479b16977893edf4af13486e88410622c9"},
    {"path": "results/C/claims.json", "kind": "file", "exists": true, "sha256": "cef4f43848ba16de8cf215c8dcc2b8067a4d759d069e51aaaecf6e43cccb8f79"},
    {"path": "reports/C_modeling_workbench.md", "kind": "file", "exists": true, "sha256": "f134d5141ec10be166646bdd2a6cad4266c63fde7c968f475de2c1b5bef2ae40"},
    {"path": "paper/figure_contracts.yaml", "kind": "file", "exists": true, "sha256": "4ea0362eaed0898d6b54403ae79f0217bbc659534884f51c0bfad9e8c620d2db"},
    {"path": "sprints/sprint-20260808T101814701038Z/merged/figure-q3q4/figure_contract_proposals.yaml", "kind": "file", "exists": true, "sha256": "ac52f93a75351e34a36a79233622757c7d1b5ce40df4b4d3ce7b7338528a0cd9"},
    {"path": "sprints/sprint-20260808T101814701038Z/merged/figure-q3q4/figure_qa_report.json", "kind": "file", "exists": true, "sha256": "fdc3dabacf850b2fbe94bff7931bcd421100cc33ecfd3504106a8190114aa66d"},
    {"path": "workspace://config/figure_style.yaml", "kind": "file", "exists": true, "sha256": "495de603619ab92cb3c6ce1b8cb18956ccdd0a82019fe9083c4d5c2a16deda1c"}
  ],
  "allowed_read_paths": [
    "problems/C/questions",
    "contest.yaml",
    "config/workflow.yaml",
    "problems/C/source/problem-C.pdf",
    "results/C/claims.json",
    "reports/C_modeling_workbench.md",
    "paper/figure_contracts.yaml",
    "paper/figures",
    "sprints/sprint-20260808T083901900797Z/merged/figure-q2",
    "sprints/sprint-20260808T101814701038Z/merged/figure-q3q4",
    "workspace://config/figure_style.yaml",
    "src",
    "workspace://src"
  ],
  "write_directory": "sprints/sprint-20260808T113706086579Z/staging/figure-q1q4-system",
  "expected_outputs": [
    "sprints/sprint-20260808T113706086579Z/staging/figure-q1q4-system/generate_c_system_workflow.py",
    "sprints/sprint-20260808T113706086579Z/staging/figure-q1q4-system/evidence_figure_coverage.json",
    "sprints/sprint-20260808T113706086579Z/staging/figure-q1q4-system/figure_contract_proposal.yaml",
    "sprints/sprint-20260808T113706086579Z/staging/figure-q1q4-system/figure_qa_report.json",
    "sprints/sprint-20260808T113706086579Z/staging/figure-q1q4-system/fig_c_system_workflow.pdf",
    "sprints/sprint-20260808T113706086579Z/staging/figure-q1q4-system/fig_c_system_workflow.svg",
    "sprints/sprint-20260808T113706086579Z/staging/figure-q1q4-system/fig_c_system_workflow.png",
    "sprints/sprint-20260808T113706086579Z/staging/figure-q1q4-system/handoff.json"
  ],
  "target_gate": "G5",
  "deadline_utc": "2026-08-10 20:00:00+08:00",
  "root_only_paths": [
    "state/decision_log.json",
    "results/C/claims.json",
    "paper/main.tex",
    "paper/figure_contracts.yaml",
    "output/"
  ],
  "sprint_profile": "default",
  "input_sprint_id": null
}
