{
  "schema_version": 1,
  "sprint_id": "sprint-20260808T083901900797Z",
  "task_id": "writer-q2q4",
  "role": "writer",
  "problem": "C",
  "question": "Q2-Q4",
  "status": "PENDING",
  "attempt": 1,
  "max_attempts": 2,
  "dependencies": [],
  "input_hashes": [
    {"path": "problems/C/questions/Q1/question.yaml", "kind": "file", "exists": true, "sha256": "a6d457c3df7d5591f393ffbca5aad8e4cf3514243a6855ebfe56fae4d3ab0333"},
    {"path": "problems/C/questions/Q2/question.yaml", "kind": "file", "exists": true, "sha256": "494f3a29fe3e99c5515977f13432dccbfeb12c787f78b16cd6eb400b79b6cb11"},
    {"path": "problems/C/questions/Q3/question.yaml", "kind": "file", "exists": true, "sha256": "6bf051de9ca11fb957dba22ceb905c1107455a4d48d8140caf47fd309543b511"},
    {"path": "problems/C/questions/Q4/question.yaml", "kind": "file", "exists": true, "sha256": "5749fcfc0c2f172008d03608949b89881894bfae91069a921df35a56092b286c"},
    {"path": "results/C/claims.json", "kind": "file", "exists": true, "sha256": "cef4f43848ba16de8cf215c8dcc2b8067a4d759d069e51aaaecf6e43cccb8f79"},
    {"path": "paper/main.tex", "kind": "file", "exists": true, "sha256": "c696b1f7e378cea391b7f8bf1704f431bf59b4a336090e563fe47a19bffcf77f"},
    {"path": "paper/figure_contracts.yaml", "kind": "file", "exists": true, "sha256": "4ea0362eaed0898d6b54403ae79f0217bbc659534884f51c0bfad9e8c620d2db"},
    {"path": "paper/sections/abstract.tex", "kind": "file", "exists": true, "sha256": "8a24bc6dfca038e6522385957729fb17abef947bb1043a8915f620658b91809b"},
    {"path": "paper/sections/body.tex", "kind": "file", "exists": true, "sha256": "7abba19fa82d4dc47caefa66815a8497578381a41ec5198ca6a92b4bfdd125ab"},
    {"path": "paper/sections/references.tex", "kind": "file", "exists": true, "sha256": "1f6c3237adf669dffcee978b934fa2075633162978714a26f5589a4fecf24ae3"},
    {"path": "paper/sections/appendix.tex", "kind": "file", "exists": true, "sha256": "63c0bcaf77c56e98b7f5c389cdbfaf53f0924f12e52be80c931614920391f13e"},
    {"path": "sprints/sprint-20260808T031146908286Z/merged/solver-q2/q2_full_summary.json", "kind": "file", "exists": true, "sha256": "68f503df0646e34d9e76680b5c104c3720a5af443c662ba32427299ee02f8cb1"},
    {"path": "sprints/sprint-20260808T031200808089Z/merged/solver-q3/q3_claim_boundary_review.json", "kind": "file", "exists": true, "sha256": "5bc6f590e3d0d869032acd26d9e65869adf39580ed3bd49015dcdd7a9778787d"},
    {"path": "sprints/sprint-20260808T031214934335Z/merged/solver-q4/q4_final_aggregate_comparison.csv", "kind": "file", "exists": true, "sha256": "056dc66bdc9685d0ecd360082980aeb8bf38524e6fb0ae413a7805fa79cf006e"},
    {"path": "sprints/sprint-20260808T051118704690Z/merged/solver-q4/q4_peak_tradeoff.csv", "kind": "file", "exists": true, "sha256": "8ed32e82b5bd8ba9c64e3b3d6bfd97bd32e306ce8248ceb1afbce3848b204fcc"}
  ],
  "allowed_read_paths": ["problems/C/questions", "contest.yaml", "config/workflow.yaml", "results/C/claims.json", "paper/main.tex", "paper/figure_contracts.yaml", "paper/sections", "experiments/C/Q2", "experiments/C/Q3", "experiments/C/Q4", "sprints/sprint-20260808T031146908286Z/merged/solver-q2", "sprints/sprint-20260808T023236665505Z/merged/solver-q3", "sprints/sprint-20260808T031200808089Z/merged/solver-q3", "sprints/sprint-20260808T031214934335Z/merged/solver-q4", "sprints/sprint-20260808T051118704690Z/merged/solver-q4", "src", "workspace://src", "workspace://corpus"],
  "write_directory": "sprints/sprint-20260808T083901900797Z/staging/writer-q2q4",
  "expected_outputs": ["sprints/sprint-20260808T083901900797Z/staging/writer-q2q4/handoff.json", "sprints/sprint-20260808T083901900797Z/staging/writer-q2q4/abstract_q2q4_proposal.tex", "sprints/sprint-20260808T083901900797Z/staging/writer-q2q4/body_q2q4_proposal.tex", "sprints/sprint-20260808T083901900797Z/staging/writer-q2q4/appendix_ai_proposal.tex", "sprints/sprint-20260808T083901900797Z/staging/writer-q2q4/writer_review.json"],
  "target_gate": "G5",
  "deadline_utc": "2026-08-10 20:00:00+08:00",
  "root_only_paths": ["state/decision_log.json", "results/C/claims.json", "paper/main.tex", "paper/figure_contracts.yaml", "output/"],
  "sprint_profile": "default",
  "input_sprint_id": null
}
