{
  "schema_version": 1,
  "sprint_id": "sprint-20260808T113706086579Z",
  "task_id": "solver-q4-joint-probe",
  "role": "solver",
  "problem": "C",
  "question": "Q4",
  "status": "PENDING",
  "attempt": 1,
  "max_attempts": 2,
  "dependencies": [],
  "input_hashes": [
    {"path": "problems/C/questions/Q2/question.yaml", "kind": "file", "exists": true, "sha256": "494f3a29fe3e99c5515977f13432dccbfeb12c787f78b16cd6eb400b79b6cb11"},
    {"path": "problems/C/questions/Q4/question.yaml", "kind": "file", "exists": true, "sha256": "5749fcfc0c2f172008d03608949b89881894bfae91069a921df35a56092b286c"},
    {"path": "contest.yaml", "kind": "file", "exists": true, "sha256": "16a7271107e2bd211293a8b735e961783dc4ac48651e9d709673e1781cd27272"},
    {"path": "config/workflow.yaml", "kind": "file", "exists": true, "sha256": "baaa782a9dd8b0d493b59163d22f5a74ec3b371c8aa0f2898a613406b9aff469"},
    {"path": "problems/C/source/problem-C.pdf", "kind": "file", "exists": true, "sha256": "0adc971ab421a7de5e3dd1c19c8540479b16977893edf4af13486e88410622c9"},
    {"path": "results/C/claims.json", "kind": "file", "exists": true, "sha256": "cef4f43848ba16de8cf215c8dcc2b8067a4d759d069e51aaaecf6e43cccb8f79"},
    {"path": "problems/C/data/workload_trace.xlsx", "kind": "file", "exists": true, "sha256": "006c0802f4a5a94a94eb7c54f8333091ac860c7d35c9c2c9ad04c68d4f0165ba"},
    {"path": "problems/C/data/GPU_information.xlsx", "kind": "file", "exists": true, "sha256": "68f978ff242da0bab54259283f647c7552693acf6db5e2212ff4e10f6a5d5d2f"},
    {"path": "problems/C/data/network_latency.xlsx", "kind": "file", "exists": true, "sha256": "f7e16fc33d8c188b0889e358497e0d96451e04c77ce765a667a50488f02ac157"},
    {"path": "problems/C/data/region_time_data.xlsx", "kind": "file", "exists": true, "sha256": "0386a1f6ae825fc4e9797528545090863817b73154050f3ba7a1068e456d55ba"},
    {"path": "problems/C/data/power_mapping.xlsx", "kind": "file", "exists": true, "sha256": "a5bea2b708cc4e5586e59bfd832b8dde7b629d212fcd8c3a0f132c03163ae39e"},
    {"path": "problems/C/data/storage_information.xlsx", "kind": "file", "exists": true, "sha256": "ff5384eb6e955079766b22432e630dfdec9f347f11cd334d950716b21692b3e4"},
    {"path": "sprints/sprint-20260808T031146908286Z/merged/solver-q2/run_q2_full_horizon.py", "kind": "file", "exists": true, "sha256": "6a39aa6eb6802a73057ae78528b18775ba2181924b7bb4fa8ad263f0214ce45f"},
    {"path": "sprints/sprint-20260808T031146908286Z/merged/solver-q2/q2_full_candidate_schedule.csv", "kind": "file", "exists": true, "sha256": "d04a57ba3cd830c771bd97fe7a9f0efa62e97978139dbcfd094cc0f098ebad54"},
    {"path": "sprints/sprint-20260808T031146908286Z/merged/solver-q2/q2_full_baseline_schedule.csv", "kind": "file", "exists": true, "sha256": "172d45d624d85f7cf7558606e551f7dee275ab726236c6b933b39d6282df370a"},
    {"path": "sprints/sprint-20260808T031214934335Z/merged/solver-q4/run_solver_q4_final.py", "kind": "file", "exists": true, "sha256": "53bbde759fb7b089656a8f14e986d824e7e86332b864232f0131f6de17a8c7f3"},
    {"path": "sprints/sprint-20260808T031214934335Z/merged/solver-q4/q4_final_summary.json", "kind": "file", "exists": true, "sha256": "4185d668ab39448c269dd33139e6c895be99de16752aa37c815cff57fb6235e7"},
    {"path": "experiments/C/Q4/q4-integrated-compat-20260808/q4_derived_summary.json", "kind": "file", "exists": true, "sha256": "26f46159818b9cc3f52ac6fae14a00e1cdcbee60f1b986e9cfa05158d447db66"},
    {"path": "sprints/sprint-20260808T101814701038Z/merged/solver-q3q4/q4_attribution.csv", "kind": "file", "exists": true, "sha256": "edfbd184640fdc89fa5c34573b47cd4f4091f8b183222fa94e754eedcbacfa06"},
    {"path": "sprints/sprint-20260808T101814701038Z/merged/solver-q3q4/q4_attribution_summary.json", "kind": "file", "exists": true, "sha256": "7d1ac95f17eee2a2c314bca8f8725a9bcdfac46081dc79e6b45da6fb27e696de"}
  ],
  "allowed_read_paths": [
    "problems/C/questions/Q2/question.yaml",
    "problems/C/questions/Q4/question.yaml",
    "contest.yaml",
    "config/workflow.yaml",
    "problems/C/source/problem-C.pdf",
    "results/C/claims.json",
    "problems/C/data/workload_trace.xlsx",
    "problems/C/data/GPU_information.xlsx",
    "problems/C/data/network_latency.xlsx",
    "problems/C/data/region_time_data.xlsx",
    "problems/C/data/power_mapping.xlsx",
    "problems/C/data/storage_information.xlsx",
    "sprints/sprint-20260808T031146908286Z/merged/solver-q2",
    "sprints/sprint-20260808T031214934335Z/merged/solver-q4",
    "experiments/C/Q4/q4-integrated-compat-20260808/q4_derived_summary.json",
    "sprints/sprint-20260808T101814701038Z/merged/solver-q3q4/q4_attribution.csv",
    "sprints/sprint-20260808T101814701038Z/merged/solver-q3q4/q4_attribution_summary.json",
    "src",
    "workspace://src"
  ],
  "write_directory": "sprints/sprint-20260808T113706086579Z/staging/solver-q4-joint-probe",
  "expected_outputs": [
    "sprints/sprint-20260808T113706086579Z/staging/solver-q4-joint-probe/run_q4_joint_probe.py",
    "sprints/sprint-20260808T113706086579Z/staging/solver-q4-joint-probe/q4_joint_probe_summary.json",
    "sprints/sprint-20260808T113706086579Z/staging/solver-q4-joint-probe/q4_joint_probe_audit.json",
    "sprints/sprint-20260808T113706086579Z/staging/solver-q4-joint-probe/run_manifest_q4_joint_probe.json",
    "sprints/sprint-20260808T113706086579Z/staging/solver-q4-joint-probe/claim_proposal_q4_joint_probe.json",
    "sprints/sprint-20260808T113706086579Z/staging/solver-q4-joint-probe/handoff.json"
  ],
  "target_gate": "G4",
  "deadline_utc": "2026-08-10 20:00:00+08:00",
  "root_only_paths": [
    "state/decision_log.json",
    "results/C/claims.json",
    "paper/main.tex",
    "paper/figure_contracts.yaml",
    "output/"
  ],
  "sprint_profile": "default",
  "input_sprint_id": null
}
