{
  "schema_version": 1,
  "sprint_id": "sprint-20260808T051118704690Z",
  "task_id": "solver-q4",
  "role": "solver",
  "problem": "C",
  "question": "Q4",
  "status": "PENDING",
  "attempt": 1,
  "max_attempts": 2,
  "dependencies": [],
  "input_hashes": [
    {
      "path": "problems/C/questions/Q4/question.yaml",
      "kind": "file",
      "exists": true,
      "sha256": "d4948775a8ca23d8dc56cabd0914997a28c2bf2cadfb14ac5a81ff6c6cc110ec"
    },
    {
      "path": "contest.yaml",
      "kind": "file",
      "exists": true,
      "sha256": "16a7271107e2bd211293a8b735e961783dc4ac48651e9d709673e1781cd27272"
    },
    {
      "path": "config/workflow.yaml",
      "kind": "file",
      "exists": true,
      "sha256": "baaa782a9dd8b0d493b59163d22f5a74ec3b371c8aa0f2898a613406b9aff469"
    },
    {
      "path": "problems/C/source/problem-C.pdf",
      "kind": "file",
      "exists": true,
      "sha256": "0adc971ab421a7de5e3dd1c19c8540479b16977893edf4af13486e88410622c9"
    },
    {
      "path": "problems/C/data/storage_information.xlsx",
      "kind": "file",
      "exists": true,
      "sha256": "ff5384eb6e955079766b22432e630dfdec9f347f11cd334d950716b21692b3e4"
    },
    {
      "path": "sprints/sprint-20260807T210015466011Z/merged/solver-q4",
      "kind": "directory",
      "exists": true,
      "sha256": "2b72059f04e8ef5955e753c91aba96e985310f5af556d988d66c3c0b0260d3f4"
    },
    {
      "path": "sprints/sprint-20260808T023235447353Z/merged/solver-q4",
      "kind": "directory",
      "exists": true,
      "sha256": "7e1da447b5fc898737084acbbd2487eef535a24832af62a5f7b8f0d39bc9a14c"
    },
    {
      "path": "sprints/sprint-20260808T031214934335Z/merged/solver-q4",
      "kind": "directory",
      "exists": true,
      "sha256": "484aaf71b419d07fceffa807e8debf0ba30ed756a09d71128e2a42173503efc2"
    }
  ],
  "allowed_read_paths": [
    "problems/C/questions/Q4/question.yaml",
    "contest.yaml",
    "config/workflow.yaml",
    "problems/C/source/problem-C.pdf",
    "problems/C/data/storage_information.xlsx",
    "sprints/sprint-20260807T210015466011Z/merged/solver-q4",
    "sprints/sprint-20260808T023235447353Z/merged/solver-q4",
    "sprints/sprint-20260808T031214934335Z/merged/solver-q4",
    "src",
    "experiments",
    "corpus",
    "workspace://src",
    "workspace://corpus"
  ],
  "write_directory": "sprints/sprint-20260808T051118704690Z/staging/solver-q4",
  "expected_outputs": [
    "sprints/sprint-20260808T051118704690Z/staging/solver-q4/handoff.json"
  ],
  "target_gate": "G5",
  "deadline_utc": "2026-08-10 20:00:00+08:00",
  "root_only_paths": [
    "state/decision_log.json",
    "results/C/claims.json",
    "paper/main.tex",
    "paper/figure_contracts.yaml",
    "output/"
  ],
  "sprint_profile": "default",
  "input_sprint_id": "sprint-20260808T023235447353Z"
}
