{
  "schema_version": 1,
  "sprint_id": "sprint-20260808T023236665505Z",
  "task_id": "solver-q3",
  "role": "solver",
  "problem": "C",
  "question": "Q3",
  "status": "PENDING",
  "attempt": 1,
  "max_attempts": 2,
  "dependencies": [],
  "input_hashes": [
    {
      "path": "problems/C/questions/Q3/question.yaml",
      "kind": "file",
      "exists": true,
      "sha256": "a5457a859ff3e4141c0a34e5b3835f64193ea4d8ba08ed91c73af0b8428a363f"
    },
    {
      "path": "contest.yaml",
      "kind": "file",
      "exists": true,
      "sha256": "16a7271107e2bd211293a8b735e961783dc4ac48651e9d709673e1781cd27272"
    },
    {
      "path": "config/workflow.yaml",
      "kind": "file",
      "exists": true,
      "sha256": "baaa782a9dd8b0d493b59163d22f5a74ec3b371c8aa0f2898a613406b9aff469"
    },
    {
      "path": "problems/C/source/problem-C.pdf",
      "kind": "file",
      "exists": true,
      "sha256": "0adc971ab421a7de5e3dd1c19c8540479b16977893edf4af13486e88410622c9"
    },
    {
      "path": "problems/C/data/region_time_data.xlsx",
      "kind": "file",
      "exists": true,
      "sha256": "0386a1f6ae825fc4e9797528545090863817b73154050f3ba7a1068e456d55ba"
    },
    {
      "path": "problems/C/data/power_mapping.xlsx",
      "kind": "file",
      "exists": true,
      "sha256": "a5bea2b708cc4e5586e59bfd832b8dde7b629d212fcd8c3a0f132c03163ae39e"
    },
    {
      "path": "problems/C/data/storage_information.xlsx",
      "kind": "file",
      "exists": true,
      "sha256": "ff5384eb6e955079766b22432e630dfdec9f347f11cd334d950716b21692b3e4"
    },
    {
      "path": "sprints/sprint-20260807T194315250Z/merged/q3-pilot",
      "kind": "directory",
      "exists": true,
      "sha256": "15298d1ed91c9882993f93ddb430f1f2430632743e651ea60b54871ff273ce63"
    }
  ],
  "allowed_read_paths": [
    "problems/C/questions/Q3/question.yaml",
    "contest.yaml",
    "config/workflow.yaml",
    "problems/C/source/problem-C.pdf",
    "problems/C/data/region_time_data.xlsx",
    "problems/C/data/power_mapping.xlsx",
    "problems/C/data/storage_information.xlsx",
    "sprints/sprint-20260807T194315250Z/merged/q3-pilot",
    "src",
    "experiments",
    "corpus",
    "workspace://src",
    "workspace://corpus"
  ],
  "write_directory": "sprints/sprint-20260808T023236665505Z/staging/solver-q3",
  "expected_outputs": [
    "sprints/sprint-20260808T023236665505Z/staging/solver-q3/handoff.json"
  ],
  "target_gate": "G5",
  "deadline_utc": "2026-08-10 20:00:00+08:00",
  "root_only_paths": [
    "state/decision_log.json",
    "results/C/claims.json",
    "paper/main.tex",
    "paper/figure_contracts.yaml",
    "output/"
  ],
  "sprint_profile": "default",
  "input_sprint_id": "sprint-20260807T194315250Z"
}
